No.     Time           Source                Destination           Protocol Length Info
      1 0.000000       192.168.1.2           192.168.1.255         NBNS     92     Name query NB ECI_DOMAIN<1c>

Frame 1: 92 bytes on wire (736 bits), 92 bytes captured (736 bits)
Ethernet II, Src: NewLink_01:6e:bd (00:e0:ed:01:6e:bd), Dst: Broadcast (ff:ff:ff:ff:ff:ff)
Internet Protocol Version 4, Src: 192.168.1.2, Dst: 192.168.1.255
User Datagram Protocol, Src Port: 137, Dst Port: 137
NetBIOS Name Service

No.     Time           Source                Destination           Protocol Length Info
      2 0.746308       192.168.1.2           192.168.1.255         NBNS     92     Name query NB ECI_DOMAIN<1c>

Frame 2: 92 bytes on wire (736 bits), 92 bytes captured (736 bits)
Ethernet II, Src: NewLink_01:6e:bd (00:e0:ed:01:6e:bd), Dst: Broadcast (ff:ff:ff:ff:ff:ff)
Internet Protocol Version 4, Src: 192.168.1.2, Dst: 192.168.1.255
User Datagram Protocol, Src Port: 137, Dst Port: 137
NetBIOS Name Service

No.     Time           Source                Destination           Protocol Length Info
      3 1.497578       192.168.1.2           192.168.1.255         NBNS     92     Name query NB ECI_DOMAIN<1c>

Frame 3: 92 bytes on wire (736 bits), 92 bytes captured (736 bits)
Ethernet II, Src: NewLink_01:6e:bd (00:e0:ed:01:6e:bd), Dst: Broadcast (ff:ff:ff:ff:ff:ff)
Internet Protocol Version 4, Src: 192.168.1.2, Dst: 192.168.1.255
User Datagram Protocol, Src Port: 137, Dst Port: 137
NetBIOS Name Service

No.     Time           Source                Destination           Protocol Length Info
      4 10.816309      NewLink_01:6e:bd      Broadcast             ARP      42     Who has 192.168.1.1? Tell 192.168.1.2

Frame 4: 42 bytes on wire (336 bits), 42 bytes captured (336 bits)
Ethernet II, Src: NewLink_01:6e:bd (00:e0:ed:01:6e:bd), Dst: Broadcast (ff:ff:ff:ff:ff:ff)
Address Resolution Protocol (request)

No.     Time           Source                Destination           Protocol Length Info
      5 10.816973      Castlene_00:34:56     NewLink_01:6e:bd      ARP      60     192.168.1.1 is at 00:30:54:00:34:56

Frame 5: 60 bytes on wire (480 bits), 60 bytes captured (480 bits)
Ethernet II, Src: Castlene_00:34:56 (00:30:54:00:34:56), Dst: NewLink_01:6e:bd (00:e0:ed:01:6e:bd)
Address Resolution Protocol (reply)

No.     Time           Source                Destination           Protocol Length Info
      6 10.816999      192.168.1.2           192.168.1.1           DNS      76     Standard query 0xb2d0 A sip.cybercity.dk

Frame 6: 76 bytes on wire (608 bits), 76 bytes captured (608 bits)
Ethernet II, Src: NewLink_01:6e:bd (00:e0:ed:01:6e:bd), Dst: Castlene_00:34:56 (00:30:54:00:34:56)
Internet Protocol Version 4, Src: 192.168.1.2, Dst: 192.168.1.1
User Datagram Protocol, Src Port: 2712, Dst Port: 53
Domain Name System (query)

No.     Time           Source                Destination           Protocol Length Info
      7 11.812382      192.168.1.2           192.168.1.1           DNS      76     Standard query 0xb2d0 A sip.cybercity.dk

Frame 7: 76 bytes on wire (608 bits), 76 bytes captured (608 bits)
Ethernet II, Src: NewLink_01:6e:bd (00:e0:ed:01:6e:bd), Dst: Castlene_00:34:56 (00:30:54:00:34:56)
Internet Protocol Version 4, Src: 192.168.1.2, Dst: 192.168.1.1
User Datagram Protocol, Src Port: 2712, Dst Port: 53
Domain Name System (query)

No.     Time           Source                Destination           Protocol Length Info
      8 13.815421      192.168.1.2           192.168.1.1           DNS      76     Standard query 0xb2d0 A sip.cybercity.dk

Frame 8: 76 bytes on wire (608 bits), 76 bytes captured (608 bits)
Ethernet II, Src: NewLink_01:6e:bd (00:e0:ed:01:6e:bd), Dst: Castlene_00:34:56 (00:30:54:00:34:56)
Internet Protocol Version 4, Src: 192.168.1.2, Dst: 192.168.1.1
User Datagram Protocol, Src Port: 2712, Dst Port: 53
Domain Name System (query)

No.     Time           Source                Destination           Protocol Length Info
      9 13.985073      192.168.1.1           192.168.1.2           DNS      144    Standard query response 0xb2d0 A sip.cybercity.dk A 212.242.33.35 NS ns2.cybercity.dk NS ns1.cybercity.dk A 212.242.41.248

Frame 9: 144 bytes on wire (1152 bits), 144 bytes captured (1152 bits)
Ethernet II, Src: Castlene_00:34:56 (00:30:54:00:34:56), Dst: NewLink_01:6e:bd (00:e0:ed:01:6e:bd)
Internet Protocol Version 4, Src: 192.168.1.1, Dst: 192.168.1.2
User Datagram Protocol, Src Port: 53, Dst Port: 2712
Domain Name System (response)

No.     Time           Source                Destination           Protocol Length Info
     10 14.991319      192.168.1.2           192.168.1.1           DNS      86     Standard query 0x4cd2 SRV _sip._udp.sip.cybercity.dk

Frame 10: 86 bytes on wire (688 bits), 86 bytes captured (688 bits)
Ethernet II, Src: NewLink_01:6e:bd (00:e0:ed:01:6e:bd), Dst: Castlene_00:34:56 (00:30:54:00:34:56)
Internet Protocol Version 4, Src: 192.168.1.2, Dst: 192.168.1.1
User Datagram Protocol, Src Port: 2713, Dst Port: 53
Domain Name System (query)

No.     Time           Source                Destination           Protocol Length Info
     11 15.988218      192.168.1.2           192.168.1.1           DNS      86     Standard query 0x4cd2 SRV _sip._udp.sip.cybercity.dk

Frame 11: 86 bytes on wire (688 bits), 86 bytes captured (688 bits)
Ethernet II, Src: NewLink_01:6e:bd (00:e0:ed:01:6e:bd), Dst: Castlene_00:34:56 (00:30:54:00:34:56)
Internet Protocol Version 4, Src: 192.168.1.2, Dst: 192.168.1.1
User Datagram Protocol, Src Port: 2713, Dst Port: 53
Domain Name System (query)

No.     Time           Source                Destination           Protocol Length Info
     12 17.991242      192.168.1.2           192.168.1.1           DNS      86     Standard query 0x4cd2 SRV _sip._udp.sip.cybercity.dk

Frame 12: 86 bytes on wire (688 bits), 86 bytes captured (688 bits)
Ethernet II, Src: NewLink_01:6e:bd (00:e0:ed:01:6e:bd), Dst: Castlene_00:34:56 (00:30:54:00:34:56)
Internet Protocol Version 4, Src: 192.168.1.2, Dst: 192.168.1.1
User Datagram Protocol, Src Port: 2713, Dst Port: 53
Domain Name System (query)

No.     Time           Source                Destination           Protocol Length Info
     13 18.983585      Castlene_00:34:56     NewLink_01:6e:bd      ARP      60     Who has 192.168.1.2? Tell 192.168.1.1

Frame 13: 60 bytes on wire (480 bits), 60 bytes captured (480 bits)
Ethernet II, Src: Castlene_00:34:56 (00:30:54:00:34:56), Dst: NewLink_01:6e:bd (00:e0:ed:01:6e:bd)
Address Resolution Protocol (request)

No.     Time           Source                Destination           Protocol Length Info
     14 18.983634      NewLink_01:6e:bd      Castlene_00:34:56     ARP      42     192.168.1.2 is at 00:e0:ed:01:6e:bd

Frame 14: 42 bytes on wire (336 bits), 42 bytes captured (336 bits)
Ethernet II, Src: NewLink_01:6e:bd (00:e0:ed:01:6e:bd), Dst: Castlene_00:34:56 (00:30:54:00:34:56)
Address Resolution Protocol (reply)

No.     Time           Source                Destination           Protocol Length Info
     15 19.994012      192.168.1.2           192.168.1.1           DNS      86     Standard query 0x4cd2 SRV _sip._udp.sip.cybercity.dk

Frame 15: 86 bytes on wire (688 bits), 86 bytes captured (688 bits)
Ethernet II, Src: NewLink_01:6e:bd (00:e0:ed:01:6e:bd), Dst: Castlene_00:34:56 (00:30:54:00:34:56)
Internet Protocol Version 4, Src: 192.168.1.2, Dst: 192.168.1.1
User Datagram Protocol, Src Port: 2713, Dst Port: 53
Domain Name System (query)

No.     Time           Source                Destination           Protocol Length Info
     16 23.999789      192.168.1.2           192.168.1.1           DNS      86     Standard query 0x4cd2 SRV _sip._udp.sip.cybercity.dk

Frame 16: 86 bytes on wire (688 bits), 86 bytes captured (688 bits)
Ethernet II, Src: NewLink_01:6e:bd (00:e0:ed:01:6e:bd), Dst: Castlene_00:34:56 (00:30:54:00:34:56)
Internet Protocol Version 4, Src: 192.168.1.2, Dst: 192.168.1.1
User Datagram Protocol, Src Port: 2713, Dst Port: 53
Domain Name System (query)

No.     Time           Source                Destination           Protocol Length Info
     17 32.001808      192.168.1.2           192.168.1.1           DNS      82     Standard query 0xabd2 PTR 1.0.0.127.in-addr.arpa

Frame 17: 82 bytes on wire (656 bits), 82 bytes captured (656 bits)
Ethernet II, Src: NewLink_01:6e:bd (00:e0:ed:01:6e:bd), Dst: Castlene_00:34:56 (00:30:54:00:34:56)
Internet Protocol Version 4, Src: 192.168.1.2, Dst: 192.168.1.1
User Datagram Protocol, Src Port: 2714, Dst Port: 53
Domain Name System (query)

No.     Time           Source                Destination           Protocol Length Info
     18 32.003297      192.168.1.1           192.168.1.2           DNS      105    Standard query response 0xabd2 PTR 1.0.0.127.in-addr.arpa PTR localhost

Frame 18: 105 bytes on wire (840 bits), 105 bytes captured (840 bits)
Ethernet II, Src: Castlene_00:34:56 (00:30:54:00:34:56), Dst: NewLink_01:6e:bd (00:e0:ed:01:6e:bd)
Internet Protocol Version 4, Src: 192.168.1.1, Dst: 192.168.1.2
User Datagram Protocol, Src Port: 53, Dst Port: 2714
Domain Name System (response)

No.     Time           Source                Destination           Protocol Length Info
     19 32.004937      192.168.1.2           212.242.33.35         SIP      509    Request: REGISTER sip:sip.cybercity.dk  (1 binding) | 

Frame 19: 509 bytes on wire (4072 bits), 509 bytes captured (4072 bits)
Ethernet II, Src: NewLink_01:6e:bd (00:e0:ed:01:6e:bd), Dst: Castlene_00:34:56 (00:30:54:00:34:56)
Internet Protocol Version 4, Src: 192.168.1.2, Dst: 212.242.33.35
User Datagram Protocol, Src Port: 5060, Dst Port: 5060
Session Initiation Protocol (REGISTER)

No.     Time           Source                Destination           Protocol Length Info
     20 32.141694      212.242.33.35         192.168.1.2           SIP      528    Status: 401 Unauthorized | 

Frame 20: 528 bytes on wire (4224 bits), 528 bytes captured (4224 bits)
Ethernet II, Src: Castlene_00:34:56 (00:30:54:00:34:56), Dst: NewLink_01:6e:bd (00:e0:ed:01:6e:bd)
Internet Protocol Version 4, Src: 212.242.33.35, Dst: 192.168.1.2
User Datagram Protocol, Src Port: 5060, Dst Port: 5060
Session Initiation Protocol (401)

No.     Time           Source                Destination           Protocol Length Info
     21 32.406750      192.168.1.2           192.168.1.1           DNS      86     Standard query 0x38d3 SRV _sip._udp.sip.cybercity.dk

Frame 21: 86 bytes on wire (688 bits), 86 bytes captured (688 bits)
Ethernet II, Src: NewLink_01:6e:bd (00:e0:ed:01:6e:bd), Dst: Castlene_00:34:56 (00:30:54:00:34:56)
Internet Protocol Version 4, Src: 192.168.1.2, Dst: 192.168.1.1
User Datagram Protocol, Src Port: 2715, Dst Port: 53
Domain Name System (query)

No.     Time           Source                Destination           Protocol Length Info
     22 33.403525      192.168.1.2           192.168.1.1           DNS      86     Standard query 0x38d3 SRV _sip._udp.sip.cybercity.dk

Frame 22: 86 bytes on wire (688 bits), 86 bytes captured (688 bits)
Ethernet II, Src: NewLink_01:6e:bd (00:e0:ed:01:6e:bd), Dst: Castlene_00:34:56 (00:30:54:00:34:56)
Internet Protocol Version 4, Src: 192.168.1.2, Dst: 192.168.1.1
User Datagram Protocol, Src Port: 2715, Dst Port: 53
Domain Name System (query)

No.     Time           Source                Destination           Protocol Length Info
     23 35.406164      192.168.1.2           192.168.1.1           DNS      86     Standard query 0x38d3 SRV _sip._udp.sip.cybercity.dk

Frame 23: 86 bytes on wire (688 bits), 86 bytes captured (688 bits)
Ethernet II, Src: NewLink_01:6e:bd (00:e0:ed:01:6e:bd), Dst: Castlene_00:34:56 (00:30:54:00:34:56)
Internet Protocol Version 4, Src: 192.168.1.2, Dst: 192.168.1.1
User Datagram Protocol, Src Port: 2715, Dst Port: 53
Domain Name System (query)

No.     Time           Source                Destination           Protocol Length Info
     24 37.409291      192.168.1.2           192.168.1.1           DNS      86     Standard query 0x38d3 SRV _sip._udp.sip.cybercity.dk

Frame 24: 86 bytes on wire (688 bits), 86 bytes captured (688 bits)
Ethernet II, Src: NewLink_01:6e:bd (00:e0:ed:01:6e:bd), Dst: Castlene_00:34:56 (00:30:54:00:34:56)
Internet Protocol Version 4, Src: 192.168.1.2, Dst: 192.168.1.1
User Datagram Protocol, Src Port: 2715, Dst Port: 53
Domain Name System (query)

No.     Time           Source                Destination           Protocol Length Info
     25 41.414930      192.168.1.2           192.168.1.1           DNS      86     Standard query 0x38d3 SRV _sip._udp.sip.cybercity.dk

Frame 25: 86 bytes on wire (688 bits), 86 bytes captured (688 bits)
Ethernet II, Src: NewLink_01:6e:bd (00:e0:ed:01:6e:bd), Dst: Castlene_00:34:56 (00:30:54:00:34:56)
Internet Protocol Version 4, Src: 192.168.1.2, Dst: 192.168.1.1
User Datagram Protocol, Src Port: 2715, Dst Port: 53
Domain Name System (query)

No.     Time           Source                Destination           Protocol Length Info
     26 48.241056      192.168.1.2           192.168.1.255         NBNS     92     Name query NB ECI_DOMAIN<1c>

Frame 26: 92 bytes on wire (736 bits), 92 bytes captured (736 bits)
Ethernet II, Src: NewLink_01:6e:bd (00:e0:ed:01:6e:bd), Dst: Broadcast (ff:ff:ff:ff:ff:ff)
Internet Protocol Version 4, Src: 192.168.1.2, Dst: 192.168.1.255
User Datagram Protocol, Src Port: 137, Dst Port: 137
NetBIOS Name Service

No.     Time           Source                Destination           Protocol Length Info
     27 48.985639      192.168.1.2           192.168.1.255         NBNS     92     Name query NB ECI_DOMAIN<1c>

Frame 27: 92 bytes on wire (736 bits), 92 bytes captured (736 bits)
Ethernet II, Src: NewLink_01:6e:bd (00:e0:ed:01:6e:bd), Dst: Broadcast (ff:ff:ff:ff:ff:ff)
Internet Protocol Version 4, Src: 192.168.1.2, Dst: 192.168.1.255
User Datagram Protocol, Src Port: 137, Dst Port: 137
NetBIOS Name Service

No.     Time           Source                Destination           Protocol Length Info
     28 49.417106      192.168.1.2           192.168.1.1           DNS      82     Standard query 0xaad3 PTR 1.0.0.127.in-addr.arpa

Frame 28: 82 bytes on wire (656 bits), 82 bytes captured (656 bits)
Ethernet II, Src: NewLink_01:6e:bd (00:e0:ed:01:6e:bd), Dst: Castlene_00:34:56 (00:30:54:00:34:56)
Internet Protocol Version 4, Src: 192.168.1.2, Dst: 192.168.1.1
User Datagram Protocol, Src Port: 2716, Dst Port: 53
Domain Name System (query)

No.     Time           Source                Destination           Protocol Length Info
     29 49.418608      192.168.1.1           192.168.1.2           DNS      105    Standard query response 0xaad3 PTR 1.0.0.127.in-addr.arpa PTR localhost

Frame 29: 105 bytes on wire (840 bits), 105 bytes captured (840 bits)
Ethernet II, Src: Castlene_00:34:56 (00:30:54:00:34:56), Dst: NewLink_01:6e:bd (00:e0:ed:01:6e:bd)
Internet Protocol Version 4, Src: 192.168.1.1, Dst: 192.168.1.2
User Datagram Protocol, Src Port: 53, Dst Port: 2716
Domain Name System (response)

No.     Time           Source                Destination           Protocol Length Info
     30 49.420564      192.168.1.2           212.242.33.35         SIP      722    Request: REGISTER sip:sip.cybercity.dk  (1 binding) | 

Frame 30: 722 bytes on wire (5776 bits), 722 bytes captured (5776 bits)
Ethernet II, Src: NewLink_01:6e:bd (00:e0:ed:01:6e:bd), Dst: Castlene_00:34:56 (00:30:54:00:34:56)
Internet Protocol Version 4, Src: 192.168.1.2, Dst: 212.242.33.35
User Datagram Protocol, Src Port: 5060, Dst Port: 5060
Session Initiation Protocol (REGISTER)

No.     Time           Source                Destination           Protocol Length Info
     31 49.566655      212.242.33.35         192.168.1.2           SIP      348    Status: 100 Trying | 

Frame 31: 348 bytes on wire (2784 bits), 348 bytes captured (2784 bits)
Ethernet II, Src: Castlene_00:34:56 (00:30:54:00:34:56), Dst: NewLink_01:6e:bd (00:e0:ed:01:6e:bd)
Internet Protocol Version 4, Src: 212.242.33.35, Dst: 192.168.1.2
User Datagram Protocol, Src Port: 5060, Dst Port: 5060
Session Initiation Protocol (100)

No.     Time           Source                Destination           Protocol Length Info
     32 49.616489      212.242.33.35         192.168.1.2           SIP      388    Status: 403 Wrong password | 

Frame 32: 388 bytes on wire (3104 bits), 388 bytes captured (3104 bits)
Ethernet II, Src: Castlene_00:34:56 (00:30:54:00:34:56), Dst: NewLink_01:6e:bd (00:e0:ed:01:6e:bd)
Internet Protocol Version 4, Src: 212.242.33.35, Dst: 192.168.1.2
User Datagram Protocol, Src Port: 5060, Dst Port: 5060
Session Initiation Protocol (403)

No.     Time           Source                Destination           Protocol Length Info
     33 49.736731      192.168.1.2           192.168.1.255         NBNS     92     Name query NB ECI_DOMAIN<1c>

Frame 33: 92 bytes on wire (736 bits), 92 bytes captured (736 bits)
Ethernet II, Src: NewLink_01:6e:bd (00:e0:ed:01:6e:bd), Dst: Broadcast (ff:ff:ff:ff:ff:ff)
Internet Protocol Version 4, Src: 192.168.1.2, Dst: 192.168.1.255
User Datagram Protocol, Src Port: 137, Dst Port: 137
NetBIOS Name Service

No.     Time           Source                Destination           Protocol Length Info
     34 54.257334      192.168.1.2           192.168.1.255         BROWSER  243    Host Announcement D002465, Workstation, Server, NT Workstation

Frame 34: 243 bytes on wire (1944 bits), 243 bytes captured (1944 bits)
Ethernet II, Src: NewLink_01:6e:bd (00:e0:ed:01:6e:bd), Dst: Broadcast (ff:ff:ff:ff:ff:ff)
Internet Protocol Version 4, Src: 192.168.1.2, Dst: 192.168.1.255
User Datagram Protocol, Src Port: 138, Dst Port: 138
NetBIOS Datagram Service
SMB (Server Message Block Protocol)
SMB MailSlot Protocol
Microsoft Windows Browser Protocol

No.     Time           Source                Destination           Protocol Length Info
     35 70.812282      192.168.1.2           147.137.21.94         TCP      62     2717 → 445 [SYN] Seq=0 Win=16384 Len=0 MSS=1460 SACK_PERM=1

Frame 35: 62 bytes on wire (496 bits), 62 bytes captured (496 bits)
Ethernet II, Src: NewLink_01:6e:bd (00:e0:ed:01:6e:bd), Dst: Castlene_00:34:56 (00:30:54:00:34:56)
Internet Protocol Version 4, Src: 192.168.1.2, Dst: 147.137.21.94
Transmission Control Protocol, Src Port: 2717, Dst Port: 445, Seq: 0, Len: 0

No.     Time           Source                Destination           Protocol Length Info
     36 70.812610      192.168.1.2           147.137.21.94         TCP      62     2718 → 139 [SYN] Seq=0 Win=16384 Len=0 MSS=1460 SACK_PERM=1

Frame 36: 62 bytes on wire (496 bits), 62 bytes captured (496 bits)
Ethernet II, Src: NewLink_01:6e:bd (00:e0:ed:01:6e:bd), Dst: Castlene_00:34:56 (00:30:54:00:34:56)
Internet Protocol Version 4, Src: 192.168.1.2, Dst: 147.137.21.94
Transmission Control Protocol, Src Port: 2718, Dst Port: 139, Seq: 0, Len: 0

No.     Time           Source                Destination           Protocol Length Info
     37 73.731185      192.168.1.2           147.137.21.94         TCP      62     [TCP Retransmission] 2718 → 139 [SYN] Seq=0 Win=16384 Len=0 MSS=1460 SACK_PERM=1

Frame 37: 62 bytes on wire (496 bits), 62 bytes captured (496 bits)
Ethernet II, Src: NewLink_01:6e:bd (00:e0:ed:01:6e:bd), Dst: Castlene_00:34:56 (00:30:54:00:34:56)
Internet Protocol Version 4, Src: 192.168.1.2, Dst: 147.137.21.94
Transmission Control Protocol, Src Port: 2718, Dst Port: 139, Seq: 0, Len: 0

No.     Time           Source                Destination           Protocol Length Info
     38 73.731277      192.168.1.2           147.137.21.94         TCP      62     [TCP Retransmission] 2717 → 445 [SYN] Seq=0 Win=16384 Len=0 MSS=1460 SACK_PERM=1

Frame 38: 62 bytes on wire (496 bits), 62 bytes captured (496 bits)
Ethernet II, Src: NewLink_01:6e:bd (00:e0:ed:01:6e:bd), Dst: Castlene_00:34:56 (00:30:54:00:34:56)
Internet Protocol Version 4, Src: 192.168.1.2, Dst: 147.137.21.94
Transmission Control Protocol, Src Port: 2717, Dst Port: 445, Seq: 0, Len: 0

No.     Time           Source                Destination           Protocol Length Info
     39 79.739812      192.168.1.2           147.137.21.94         TCP      62     [TCP Retransmission] 2718 → 139 [SYN] Seq=0 Win=16384 Len=0 MSS=1460 SACK_PERM=1

Frame 39: 62 bytes on wire (496 bits), 62 bytes captured (496 bits)
Ethernet II, Src: NewLink_01:6e:bd (00:e0:ed:01:6e:bd), Dst: Castlene_00:34:56 (00:30:54:00:34:56)
Internet Protocol Version 4, Src: 192.168.1.2, Dst: 147.137.21.94
Transmission Control Protocol, Src Port: 2718, Dst Port: 139, Seq: 0, Len: 0

No.     Time           Source                Destination           Protocol Length Info
     40 79.739895      192.168.1.2           147.137.21.94         TCP      62     [TCP Retransmission] 2717 → 445 [SYN] Seq=0 Win=16384 Len=0 MSS=1460 SACK_PERM=1

Frame 40: 62 bytes on wire (496 bits), 62 bytes captured (496 bits)
Ethernet II, Src: NewLink_01:6e:bd (00:e0:ed:01:6e:bd), Dst: Castlene_00:34:56 (00:30:54:00:34:56)
Internet Protocol Version 4, Src: 192.168.1.2, Dst: 147.137.21.94
Transmission Control Protocol, Src Port: 2717, Dst Port: 445, Seq: 0, Len: 0

No.     Time           Source                Destination           Protocol Length Info
     41 91.989965      192.168.1.2           192.168.1.1           DNS      75     Standard query 0xedd4 A ftp.ecitele.com

Frame 41: 75 bytes on wire (600 bits), 75 bytes captured (600 bits)
Ethernet II, Src: NewLink_01:6e:bd (00:e0:ed:01:6e:bd), Dst: Castlene_00:34:56 (00:30:54:00:34:56)
Internet Protocol Version 4, Src: 192.168.1.2, Dst: 192.168.1.1
User Datagram Protocol, Src Port: 2719, Dst Port: 53
Domain Name System (query)

No.     Time           Source                Destination           Protocol Length Info
     42 92.989466      192.168.1.2           192.168.1.1           DNS      75     Standard query 0xedd4 A ftp.ecitele.com

Frame 42: 75 bytes on wire (600 bits), 75 bytes captured (600 bits)
Ethernet II, Src: NewLink_01:6e:bd (00:e0:ed:01:6e:bd), Dst: Castlene_00:34:56 (00:30:54:00:34:56)
Internet Protocol Version 4, Src: 192.168.1.2, Dst: 192.168.1.1
User Datagram Protocol, Src Port: 2719, Dst Port: 53
Domain Name System (query)

No.     Time           Source                Destination           Protocol Length Info
     43 94.001208      192.168.1.1           192.168.1.2           DNS      168    Standard query response 0xedd4 A ftp.ecitele.com CNAME dns.ecitele.com A 147.234.1.253 NS ns.barak.net.il NS dns.ecitele.com A 212.150.48.169

Frame 43: 168 bytes on wire (1344 bits), 168 bytes captured (1344 bits)
Ethernet II, Src: Castlene_00:34:56 (00:30:54:00:34:56), Dst: NewLink_01:6e:bd (00:e0:ed:01:6e:bd)
Internet Protocol Version 4, Src: 192.168.1.1, Dst: 192.168.1.2
User Datagram Protocol, Src Port: 53, Dst Port: 2719
Domain Name System (response)

No.     Time           Source                Destination           Protocol Length Info
     44 94.039026      192.168.1.2           147.234.1.253         TCP      62     2720 → 21 [SYN] Seq=0 Win=16384 Len=0 MSS=1460 SACK_PERM=1

Frame 44: 62 bytes on wire (496 bits), 62 bytes captured (496 bits)
Ethernet II, Src: NewLink_01:6e:bd (00:e0:ed:01:6e:bd), Dst: Castlene_00:34:56 (00:30:54:00:34:56)
Internet Protocol Version 4, Src: 192.168.1.2, Dst: 147.234.1.253
Transmission Control Protocol, Src Port: 2720, Dst Port: 21, Seq: 0, Len: 0

No.     Time           Source                Destination           Protocol Length Info
     45 94.057271      147.234.1.253         192.168.1.2           TCP      62     21 → 2720 [SYN, ACK] Seq=0 Ack=1 Win=25398 Len=0 SACK_PERM=1 MSS=1411

Frame 45: 62 bytes on wire (496 bits), 62 bytes captured (496 bits)
Ethernet II, Src: Castlene_00:34:56 (00:30:54:00:34:56), Dst: NewLink_01:6e:bd (00:e0:ed:01:6e:bd)
Internet Protocol Version 4, Src: 147.234.1.253, Dst: 192.168.1.2
Transmission Control Protocol, Src Port: 21, Dst Port: 2720, Seq: 0, Ack: 1, Len: 0

No.     Time           Source                Destination           Protocol Length Info
     46 94.057353      192.168.1.2           147.234.1.253         TCP      54     2720 → 21 [ACK] Seq=1 Ack=1 Win=16932 Len=0

Frame 46: 54 bytes on wire (432 bits), 54 bytes captured (432 bits)
Ethernet II, Src: NewLink_01:6e:bd (00:e0:ed:01:6e:bd), Dst: Castlene_00:34:56 (00:30:54:00:34:56)
Internet Protocol Version 4, Src: 192.168.1.2, Dst: 147.234.1.253
Transmission Control Protocol, Src Port: 2720, Dst Port: 21, Seq: 1, Ack: 1, Len: 0

No.     Time           Source                Destination           Protocol Length Info
     47 94.153897      147.234.1.253         192.168.1.2           FTP      108    Response: 220 ProFTPD Server In ECI Telecom (ftp.ecitele.com) 

Frame 47: 108 bytes on wire (864 bits), 108 bytes captured (864 bits)
Ethernet II, Src: Castlene_00:34:56 (00:30:54:00:34:56), Dst: NewLink_01:6e:bd (00:e0:ed:01:6e:bd)
Internet Protocol Version 4, Src: 147.234.1.253, Dst: 192.168.1.2
Transmission Control Protocol, Src Port: 21, Dst Port: 2720, Seq: 1, Ack: 1, Len: 54
File Transfer Protocol (FTP)

No.     Time           Source                Destination           Protocol Length Info
     48 94.154372      192.168.1.2           147.234.1.253         FTP      70     Request: USER anonymous

Frame 48: 70 bytes on wire (560 bits), 70 bytes captured (560 bits)
Ethernet II, Src: NewLink_01:6e:bd (00:e0:ed:01:6e:bd), Dst: Castlene_00:34:56 (00:30:54:00:34:56)
Internet Protocol Version 4, Src: 192.168.1.2, Dst: 147.234.1.253
Transmission Control Protocol, Src Port: 2720, Dst Port: 21, Seq: 1, Ack: 55, Len: 16
File Transfer Protocol (FTP)

No.     Time           Source                Destination           Protocol Length Info
     49 94.168796      147.234.1.253         192.168.1.2           TCP      60     21 → 2720 [ACK] Seq=55 Ack=17 Win=25398 Len=0

Frame 49: 60 bytes on wire (480 bits), 60 bytes captured (480 bits)
Ethernet II, Src: Castlene_00:34:56 (00:30:54:00:34:56), Dst: NewLink_01:6e:bd (00:e0:ed:01:6e:bd)
Internet Protocol Version 4, Src: 147.234.1.253, Dst: 192.168.1.2
Transmission Control Protocol, Src Port: 21, Dst Port: 2720, Seq: 55, Ack: 17, Len: 0

No.     Time           Source                Destination           Protocol Length Info
     50 94.171235      147.234.1.253         192.168.1.2           FTP      130    Response: 331 Anonymous login ok, send your complete email address as your password.

Frame 50: 130 bytes on wire (1040 bits), 130 bytes captured (1040 bits)
Ethernet II, Src: Castlene_00:34:56 (00:30:54:00:34:56), Dst: NewLink_01:6e:bd (00:e0:ed:01:6e:bd)
Internet Protocol Version 4, Src: 147.234.1.253, Dst: 192.168.1.2
Transmission Control Protocol, Src Port: 21, Dst Port: 2720, Seq: 55, Ack: 17, Len: 76
File Transfer Protocol (FTP)

No.     Time           Source                Destination           Protocol Length Info
     51 94.173642      192.168.1.2           147.234.1.253         FTP      66     Request: PASS d0xa!

Frame 51: 66 bytes on wire (528 bits), 66 bytes captured (528 bits)
Ethernet II, Src: NewLink_01:6e:bd (00:e0:ed:01:6e:bd), Dst: Castlene_00:34:56 (00:30:54:00:34:56)
Internet Protocol Version 4, Src: 192.168.1.2, Dst: 147.234.1.253
Transmission Control Protocol, Src Port: 2720, Dst Port: 21, Seq: 17, Ack: 131, Len: 12
File Transfer Protocol (FTP)

No.     Time           Source                Destination           Protocol Length Info
     52 94.187272      147.234.1.253         192.168.1.2           TCP      60     21 → 2720 [ACK] Seq=131 Ack=29 Win=25398 Len=0

Frame 52: 60 bytes on wire (480 bits), 60 bytes captured (480 bits)
Ethernet II, Src: Castlene_00:34:56 (00:30:54:00:34:56), Dst: NewLink_01:6e:bd (00:e0:ed:01:6e:bd)
Internet Protocol Version 4, Src: 147.234.1.253, Dst: 192.168.1.2
Transmission Control Protocol, Src Port: 21, Dst Port: 2720, Seq: 131, Ack: 29, Len: 0

No.     Time           Source                Destination           Protocol Length Info
     53 94.202280      147.234.1.253         192.168.1.2           FTP      85     Response: 230-Welcome To ECI FTP Server

Frame 53: 85 bytes on wire (680 bits), 85 bytes captured (680 bits)
Ethernet II, Src: Castlene_00:34:56 (00:30:54:00:34:56), Dst: NewLink_01:6e:bd (00:e0:ed:01:6e:bd)
Internet Protocol Version 4, Src: 147.234.1.253, Dst: 192.168.1.2
Transmission Control Protocol, Src Port: 21, Dst Port: 2720, Seq: 131, Ack: 29, Len: 31
File Transfer Protocol (FTP)

No.     Time           Source                Destination           Protocol Length Info
     54 94.203071      147.234.1.253         192.168.1.2           FTP      60     Response:  

Frame 54: 60 bytes on wire (480 bits), 60 bytes captured (480 bits)
Ethernet II, Src: Castlene_00:34:56 (00:30:54:00:34:56), Dst: NewLink_01:6e:bd (00:e0:ed:01:6e:bd)
Internet Protocol Version 4, Src: 147.234.1.253, Dst: 192.168.1.2
Transmission Control Protocol, Src Port: 21, Dst Port: 2720, Seq: 162, Ack: 29, Len: 3
File Transfer Protocol (FTP)

No.     Time           Source                Destination           Protocol Length Info
     55 94.203123      192.168.1.2           147.234.1.253         TCP      54     2720 → 21 [ACK] Seq=29 Ack=165 Win=16768 Len=0

Frame 55: 54 bytes on wire (432 bits), 54 bytes captured (432 bits)
Ethernet II, Src: NewLink_01:6e:bd (00:e0:ed:01:6e:bd), Dst: Castlene_00:34:56 (00:30:54:00:34:56)
Internet Protocol Version 4, Src: 192.168.1.2, Dst: 147.234.1.253
Transmission Control Protocol, Src Port: 2720, Dst Port: 21, Seq: 29, Ack: 165, Len: 0

No.     Time           Source                Destination           Protocol Length Info
     56 94.203275      147.234.1.253         192.168.1.2           FTP      60     Response:  

Frame 56: 60 bytes on wire (480 bits), 60 bytes captured (480 bits)
Ethernet II, Src: Castlene_00:34:56 (00:30:54:00:34:56), Dst: NewLink_01:6e:bd (00:e0:ed:01:6e:bd)
Internet Protocol Version 4, Src: 147.234.1.253, Dst: 192.168.1.2
Transmission Control Protocol, Src Port: 21, Dst Port: 2720, Seq: 165, Ack: 29, Len: 3
File Transfer Protocol (FTP)

No.     Time           Source                Destination           Protocol Length Info
     57 94.204139      147.234.1.253         192.168.1.2           FTP      81     Response:  /pub\t\t-> Public Folder. 

Frame 57: 81 bytes on wire (648 bits), 81 bytes captured (648 bits)
Ethernet II, Src: Castlene_00:34:56 (00:30:54:00:34:56), Dst: NewLink_01:6e:bd (00:e0:ed:01:6e:bd)
Internet Protocol Version 4, Src: 147.234.1.253, Dst: 192.168.1.2
Transmission Control Protocol, Src Port: 21, Dst Port: 2720, Seq: 168, Ack: 29, Len: 27
File Transfer Protocol (FTP)

No.     Time           Source                Destination           Protocol Length Info
     58 94.204169      192.168.1.2           147.234.1.253         TCP      54     2720 → 21 [ACK] Seq=29 Ack=195 Win=16738 Len=0

Frame 58: 54 bytes on wire (432 bits), 54 bytes captured (432 bits)
Ethernet II, Src: NewLink_01:6e:bd (00:e0:ed:01:6e:bd), Dst: Castlene_00:34:56 (00:30:54:00:34:56)
Internet Protocol Version 4, Src: 192.168.1.2, Dst: 147.234.1.253
Transmission Control Protocol, Src Port: 2720, Dst Port: 21, Seq: 29, Ack: 195, Len: 0

No.     Time           Source                Destination           Protocol Length Info
     59 94.204428      147.234.1.253         192.168.1.2           FTP      89     Response:  \t\t   ECI users can do everything

Frame 59: 89 bytes on wire (712 bits), 89 bytes captured (712 bits)
Ethernet II, Src: Castlene_00:34:56 (00:30:54:00:34:56), Dst: NewLink_01:6e:bd (00:e0:ed:01:6e:bd)
Internet Protocol Version 4, Src: 147.234.1.253, Dst: 192.168.1.2
Transmission Control Protocol, Src Port: 21, Dst Port: 2720, Seq: 195, Ack: 29, Len: 35
File Transfer Protocol (FTP)

No.     Time           Source                Destination           Protocol Length Info
     60 94.204733      147.234.1.253         192.168.1.2           FTP      82     Response:  \t\t   Others can only read

Frame 60: 82 bytes on wire (656 bits), 82 bytes captured (656 bits)
Ethernet II, Src: Castlene_00:34:56 (00:30:54:00:34:56), Dst: NewLink_01:6e:bd (00:e0:ed:01:6e:bd)
Internet Protocol Version 4, Src: 147.234.1.253, Dst: 192.168.1.2
Transmission Control Protocol, Src Port: 21, Dst Port: 2720, Seq: 230, Ack: 29, Len: 28
File Transfer Protocol (FTP)

No.     Time           Source                Destination           Protocol Length Info
     61 94.204762      192.168.1.2           147.234.1.253         TCP      54     2720 → 21 [ACK] Seq=29 Ack=258 Win=16675 Len=0

Frame 61: 54 bytes on wire (432 bits), 54 bytes captured (432 bits)
Ethernet II, Src: NewLink_01:6e:bd (00:e0:ed:01:6e:bd), Dst: Castlene_00:34:56 (00:30:54:00:34:56)
Internet Protocol Version 4, Src: 192.168.1.2, Dst: 147.234.1.253
Transmission Control Protocol, Src Port: 2720, Dst Port: 21, Seq: 29, Ack: 258, Len: 0

No.     Time           Source                Destination           Protocol Length Info
     62 94.204848      147.234.1.253         192.168.1.2           FTP      87     Response:  /incoming\t-> Incoming Folder. 

Frame 62: 87 bytes on wire (696 bits), 87 bytes captured (696 bits)
Ethernet II, Src: Castlene_00:34:56 (00:30:54:00:34:56), Dst: NewLink_01:6e:bd (00:e0:ed:01:6e:bd)
Internet Protocol Version 4, Src: 147.234.1.253, Dst: 192.168.1.2
Transmission Control Protocol, Src Port: 21, Dst Port: 2720, Seq: 258, Ack: 29, Len: 33
File Transfer Protocol (FTP)

No.     Time           Source                Destination           Protocol Length Info
     63 94.206103      147.234.1.253         192.168.1.2           FTP      113    Response:  \t\t   Anyone can access, write & retrieve a specific file

Frame 63: 113 bytes on wire (904 bits), 113 bytes captured (904 bits)
Ethernet II, Src: Castlene_00:34:56 (00:30:54:00:34:56), Dst: NewLink_01:6e:bd (00:e0:ed:01:6e:bd)
Internet Protocol Version 4, Src: 147.234.1.253, Dst: 192.168.1.2
Transmission Control Protocol, Src Port: 21, Dst Port: 2720, Seq: 291, Ack: 29, Len: 59
File Transfer Protocol (FTP)

No.     Time           Source                Destination           Protocol Length Info
     64 94.206132      192.168.1.2           147.234.1.253         TCP      54     2720 → 21 [ACK] Seq=29 Ack=350 Win=16583 Len=0

Frame 64: 54 bytes on wire (432 bits), 54 bytes captured (432 bits)
Ethernet II, Src: NewLink_01:6e:bd (00:e0:ed:01:6e:bd), Dst: Castlene_00:34:56 (00:30:54:00:34:56)
Internet Protocol Version 4, Src: 192.168.1.2, Dst: 147.234.1.253
Transmission Control Protocol, Src Port: 2720, Dst Port: 21, Seq: 29, Ack: 350, Len: 0

No.     Time           Source                Destination           Protocol Length Info
     65 94.206463      147.234.1.253         192.168.1.2           FTP      87     Response:  /outgoing\t-> outgoing Folder. 

Frame 65: 87 bytes on wire (696 bits), 87 bytes captured (696 bits)
Ethernet II, Src: Castlene_00:34:56 (00:30:54:00:34:56), Dst: NewLink_01:6e:bd (00:e0:ed:01:6e:bd)
Internet Protocol Version 4, Src: 147.234.1.253, Dst: 192.168.1.2
Transmission Control Protocol, Src Port: 21, Dst Port: 2720, Seq: 350, Ack: 29, Len: 33
File Transfer Protocol (FTP)

No.     Time           Source                Destination           Protocol Length Info
     66 94.207254      147.234.1.253         192.168.1.2           FTP      113    Response:  \t\t   Anyone can access, write & retrieve a specific file

Frame 66: 113 bytes on wire (904 bits), 113 bytes captured (904 bits)
Ethernet II, Src: Castlene_00:34:56 (00:30:54:00:34:56), Dst: NewLink_01:6e:bd (00:e0:ed:01:6e:bd)
Internet Protocol Version 4, Src: 147.234.1.253, Dst: 192.168.1.2
Transmission Control Protocol, Src Port: 21, Dst Port: 2720, Seq: 383, Ack: 29, Len: 59
File Transfer Protocol (FTP)

No.     Time           Source                Destination           Protocol Length Info
     67 94.207284      192.168.1.2           147.234.1.253         TCP      54     2720 → 21 [ACK] Seq=29 Ack=442 Win=16491 Len=0

Frame 67: 54 bytes on wire (432 bits), 54 bytes captured (432 bits)
Ethernet II, Src: NewLink_01:6e:bd (00:e0:ed:01:6e:bd), Dst: Castlene_00:34:56 (00:30:54:00:34:56)
Internet Protocol Version 4, Src: 192.168.1.2, Dst: 147.234.1.253
Transmission Control Protocol, Src Port: 2720, Dst Port: 21, Seq: 29, Ack: 442, Len: 0

No.     Time           Source                Destination           Protocol Length Info
     68 94.207671      147.234.1.253         192.168.1.2           FTP      60     Response:  

Frame 68: 60 bytes on wire (480 bits), 60 bytes captured (480 bits)
Ethernet II, Src: Castlene_00:34:56 (00:30:54:00:34:56), Dst: NewLink_01:6e:bd (00:e0:ed:01:6e:bd)
Internet Protocol Version 4, Src: 147.234.1.253, Dst: 192.168.1.2
Transmission Control Protocol, Src Port: 21, Dst Port: 2720, Seq: 442, Ack: 29, Len: 3
File Transfer Protocol (FTP)

No.     Time           Source                Destination           Protocol Length Info
     69 94.208975      147.234.1.253         192.168.1.2           FTP      113    Response:  Files larger then 250MB will be deleted after 5 days !!!

Frame 69: 113 bytes on wire (904 bits), 113 bytes captured (904 bits)
Ethernet II, Src: Castlene_00:34:56 (00:30:54:00:34:56), Dst: NewLink_01:6e:bd (00:e0:ed:01:6e:bd)
Internet Protocol Version 4, Src: 147.234.1.253, Dst: 192.168.1.2
Transmission Control Protocol, Src Port: 21, Dst Port: 2720, Seq: 445, Ack: 29, Len: 59
File Transfer Protocol (FTP)

No.     Time           Source                Destination           Protocol Length Info
     70 94.209005      192.168.1.2           147.234.1.253         TCP      54     2720 → 21 [ACK] Seq=29 Ack=504 Win=16429 Len=0

Frame 70: 54 bytes on wire (432 bits), 54 bytes captured (432 bits)
Ethernet II, Src: NewLink_01:6e:bd (00:e0:ed:01:6e:bd), Dst: Castlene_00:34:56 (00:30:54:00:34:56)
Internet Protocol Version 4, Src: 192.168.1.2, Dst: 147.234.1.253
Transmission Control Protocol, Src Port: 2720, Dst Port: 21, Seq: 29, Ack: 504, Len: 0

No.     Time           Source                Destination           Protocol Length Info
     71 94.209838      147.234.1.253         192.168.1.2           FTP      102    Response:  Other Files will be deleted after 2 weeks !!!

Frame 71: 102 bytes on wire (816 bits), 102 bytes captured (816 bits)
Ethernet II, Src: Castlene_00:34:56 (00:30:54:00:34:56), Dst: NewLink_01:6e:bd (00:e0:ed:01:6e:bd)
Internet Protocol Version 4, Src: 147.234.1.253, Dst: 192.168.1.2
Transmission Control Protocol, Src Port: 21, Dst Port: 2720, Seq: 504, Ack: 29, Len: 48
File Transfer Protocol (FTP)

No.     Time           Source                Destination           Protocol Length Info
     72 94.210125      147.234.1.253         192.168.1.2           FTP      60     Response:  

Frame 72: 60 bytes on wire (480 bits), 60 bytes captured (480 bits)
Ethernet II, Src: Castlene_00:34:56 (00:30:54:00:34:56), Dst: NewLink_01:6e:bd (00:e0:ed:01:6e:bd)
Internet Protocol Version 4, Src: 147.234.1.253, Dst: 192.168.1.2
Transmission Control Protocol, Src Port: 21, Dst Port: 2720, Seq: 552, Ack: 29, Len: 3
File Transfer Protocol (FTP)

No.     Time           Source                Destination           Protocol Length Info
     73 94.210155      192.168.1.2           147.234.1.253         TCP      54     2720 → 21 [ACK] Seq=29 Ack=555 Win=16378 Len=0

Frame 73: 54 bytes on wire (432 bits), 54 bytes captured (432 bits)
Ethernet II, Src: NewLink_01:6e:bd (00:e0:ed:01:6e:bd), Dst: Castlene_00:34:56 (00:30:54:00:34:56)
Internet Protocol Version 4, Src: 192.168.1.2, Dst: 147.234.1.253
Transmission Control Protocol, Src Port: 2720, Dst Port: 21, Seq: 29, Ack: 555, Len: 0

No.     Time           Source                Destination           Protocol Length Info
     74 94.210232      147.234.1.253         192.168.1.2           FTP      60     Response:  

Frame 74: 60 bytes on wire (480 bits), 60 bytes captured (480 bits)
Ethernet II, Src: Castlene_00:34:56 (00:30:54:00:34:56), Dst: NewLink_01:6e:bd (00:e0:ed:01:6e:bd)
Internet Protocol Version 4, Src: 147.234.1.253, Dst: 192.168.1.2
Transmission Control Protocol, Src Port: 21, Dst Port: 2720, Seq: 555, Ack: 29, Len: 3
File Transfer Protocol (FTP)

